{
  "format": "mantle-source-bundle-v1",
  "store_prefix": "/mantle/store",
  "record_count": 1,
  "payload_bytes": 12,
  "ready_class": "ready",
  "records": [
    {
      "kind": "local-path",
      "identity": "source/example",
      "payload_bytes": 12,
      "content_blake3": "aaaaaaaaaaaaaaaaaaaaaaaaaaaaaaaaaaaaaaaaaaaaaaaaaaaaaaaaaaaaaaaa",
      "file_count": 1
    }
  ],
  "non_claim": "source bundle evidence proves declared source/input availability and identity only"
}
